<?xml version="1.0" encoding="UTF-8"?>
<!DOCTYPE classrooms SYSTEM "my-stud.dtd">
<classrooms>
	<classroom id="">
		<students>
			<student>
				<abc></abc>
				<age></age>
				<id></id>
				<studentname></studentname>
			</student>
		</students>
	</classroom>
</classrooms>
